{
  "schema_version": "x07.mcp.rr.http_session@0.1.0",
  "id": "smoke.basic",
  "profile": "record",
  "project_files": {},
  "base_url": "http://127.0.0.1:18080",
  "mcp_path": "/mcp",
  "steps": [
    {
      "name": "initialize",
      "req": {
        "method": "POST",
        "path": "/mcp",
        "headers": {
          "Accept": "application/json, text/event-stream",
          "Authorization": "Bearer [REDACTED:bearer]",
          "Content-Type": "application/json",
          "MCP-Protocol-Version": "2025-11-25",
          "Origin": "http://localhost:3000"
        },
        "body_json": {
          "jsonrpc": "2.0",
          "id": 1,
          "method": "initialize",
          "params": { "protocolVersion": "2025-11-25", "capabilities": {} }
        }
      },
      "res": {
        "status": 200,
        "headers": {},
        "body_json": { "jsonrpc": "2.0", "id": 1, "result": {} }
      }
    },
    {
      "name": "initialized_notification",
      "req": {
        "method": "POST",
        "path": "/mcp",
        "headers": {
          "Accept": "application/json, text/event-stream",
          "Authorization": "Bearer [REDACTED:bearer]",
          "Content-Type": "application/json",
          "MCP-Protocol-Version": "2025-11-25",
          "Origin": "http://localhost:3000"
        },
        "body_json": {
          "jsonrpc": "2.0",
          "method": "notifications/initialized",
          "params": {}
        }
      },
      "res": { "status": 202, "headers": {}, "body_empty": true }
    },
    {
      "name": "tools_list",
      "req": {
        "method": "POST",
        "path": "/mcp",
        "headers": {
          "Accept": "application/json, text/event-stream",
          "Authorization": "Bearer [REDACTED:bearer]",
          "Content-Type": "application/json",
          "MCP-Protocol-Version": "2025-11-25",
          "Origin": "http://localhost:3000"
        },
        "body_json": {
          "jsonrpc": "2.0",
          "id": 2,
          "method": "tools/list",
          "params": {}
        }
      },
      "res": {
        "status": 200,
        "headers": {},
        "body_json": { "jsonrpc": "2.0", "id": 2, "result": { "tools": [] } }
      }
    }
  ]
}

